{
  "schema_version": "1.0",
  "schema": "docs/schemas/changes.schema.json",
  "source": {
    "old_file": "examples\\sample_input\\old.xml",
    "new_file": "examples\\sample_input\\new.xml",
    "old_title": "Synthetic Windows and Linux STIG",
    "new_title": "Synthetic Windows and Linux STIG",
    "old_version": "V1R1",
    "new_version": "V1R2",
    "old_release": "Release 1 (2026-01-01)",
    "new_release": "Release 2 (2026-03-01)",
    "old_control_count": 3,
    "new_control_count": 3
  },
  "summary": {
    "total": 4,
    "added": 1,
    "removed": 1,
    "modified": 2,
    "severity_changed": 1,
    "high_priority_review": 2,
    "implementation_change_likely": 0,
    "evidence_update_likely": 1
  },
  "changes": [
    {
      "change_type": "added",
      "impact": "high_priority_review",
      "impact_label": "High-priority review",
      "reason": "A new high-severity control was added, so it should be triaged before lower-risk backlog work.",
      "changed_fields": [],
      "suggested_owner": "Network/Security Engineering",
      "evidence_needed": [
        "Screenshot or export of the relevant setting",
        "Network device configuration excerpt or management console export",
        "Date/time of validation",
        "System or asset name",
        "Reviewer notes"
      ],
      "control": {
        "title": "Firewall management access must be restricted",
        "vuln_id": "V-100004",
        "rule_id": "SV-100004r1_rule",
        "group_id": "V-100004",
        "stig_id": "APP-NW-000030",
        "severity": "high",
        "tags": [
          "Network Security"
        ],
        "cci_refs": [
          "CCI-000004"
        ],
        "references": [],
        "check_summary": "Review firewall management network restrictions and approved admin source ranges.",
        "fix_summary": "Restrict firewall management access to approved networks."
      }
    },
    {
      "change_type": "removed",
      "impact": "review_recommended",
      "impact_label": "Review recommended",
      "reason": "The control was removed, so downstream tickets, evidence requests, or mappings may need cleanup.",
      "changed_fields": [],
      "suggested_owner": "Database Admin",
      "evidence_needed": [
        "Screenshot or export of the relevant setting",
        "Database configuration query output or parameter export",
        "Date/time of validation",
        "System or asset name",
        "Reviewer notes"
      ],
      "control": {
        "title": "Removed database audit control",
        "vuln_id": "V-100003",
        "rule_id": "SV-100003r1_rule",
        "group_id": "V-100003",
        "stig_id": "APP-DB-000020",
        "severity": "medium",
        "tags": [
          "Audit Logging",
          "Database"
        ],
        "cci_refs": [],
        "references": [],
        "check_summary": "Review SQL audit settings.",
        "fix_summary": "Configure SQL audit settings."
      }
    },
    {
      "change_type": "severity_increased",
      "impact": "high_priority_review",
      "impact_label": "High-priority review",
      "reason": "The severity increased to high and the remediation text changed, so old tickets or implementation notes should not be reused without review.",
      "changed_fields": [
        "title",
        "severity",
        "check_text",
        "fix_text",
        "references"
      ],
      "suggested_owner": "Endpoint/Windows Admin",
      "evidence_needed": [
        "Screenshot or export of the relevant setting",
        "GPO, registry, or Local Security Policy export",
        "Date/time of validation",
        "System or asset name",
        "Reviewer notes"
      ],
      "control": {
        "title": "Windows audit policy must be configured and reviewed",
        "vuln_id": "V-100001",
        "rule_id": "SV-100001r2_rule",
        "group_id": "V-100001",
        "stig_id": "APP-AU-000001",
        "severity": "high",
        "tags": [
          "Audit Logging",
          "Endpoint Security",
          "Windows",
          "GPO"
        ],
        "cci_refs": [
          "CCI-000001"
        ],
        "references": [
          "VulnDiscussion: Audit policy gaps reduce investigation quality and may require updated evidence exports.",
          "https://example.invalid/audit-r2 | Audit policy reference R2"
        ],
        "check_summary": "Review Windows audit policy settings in Local Security Policy and export applied GPO evidence.",
        "fix_summary": "Configure Windows audit policy through GPO and document the applied baseline."
      }
    },
    {
      "change_type": "check_changed",
      "impact": "evidence_update_likely",
      "impact_label": "Evidence update likely",
      "reason": "The check procedure changed enough that evidence requests or validation steps may need to be refreshed.",
      "changed_fields": [
        "check_text"
      ],
      "suggested_owner": "Linux Admin",
      "evidence_needed": [
        "Screenshot or export of the relevant setting",
        "Command output showing the configured value",
        "Relevant policy or configuration file excerpt",
        "Date/time of validation",
        "System or asset name",
        "Reviewer notes"
      ],
      "control": {
        "title": "Linux SSH banner must be configured",
        "vuln_id": "V-100002",
        "rule_id": "SV-100002r2_rule",
        "group_id": "V-100002",
        "stig_id": "APP-LX-000010",
        "severity": "low",
        "tags": [
          "Remote Access",
          "Linux"
        ],
        "cci_refs": [
          "CCI-000002"
        ],
        "references": [],
        "check_summary": "Run sshd -T and review the banner setting and file permissions.",
        "fix_summary": "Configure the sshd Banner directive in /etc/ssh/sshd_config."
      }
    }
  ]
}